"Title","Created","LastEdited","Agency","Description","ProblemBy","ProblemOf","Status","Votes","ID"
"Top 1000 Māori Baby Names (Male and Female) Since 1950","2023-03-26 18:02:57","2023-11-23 05:45:52","Department of Internal Affairs","This would list the top 1000 Māori names for babies for each year from 1954. Provided as a csv file with ""years"" as columns (two colums for each year: male, female). Each row would contain the position of the name in the top 1000, with the top name in the first row and the 1000th name in the last row.","1) Providing the raw data for analysis using data-scientific tools

2) Provide a list of names that can be inserted into text, found in recordings or recorded in studio and supplied to an Artificial Intelligence during training.","1) Understanding how names have evolved over time, how the popularity of names from Te Paipera Tapu (Judeo-Māori names) / pre-Paipera names has changed over time.

2) Provide those training Artificial Intelligence (AI) for automatic transcription / speech synthesis with a list of names likely to be encountered. This would ultimately allow designers to create tools for e.g. government that are capable of working with Māori names which is not currently the case for tools delivered by almost all AI service providers.","Agency notified","3","880"
"Nga Whenua Rahui areas Waitomo District","2019-01-10 11:13:00","2020-11-23 15:23:19","Department of Conservation","DoC - Nga Whenua Rahui areas for the Waitomo District as ESRI Shapefiles, NZTM2000","Allowing GIS overlays and analysis, to determine areas affected","Criteria to identify areas of significant indigenous biodiversity and determine their significance as per Regional Policy Statement","Agency responded","3","370"
"Auckland Rent By Suburbs","2019-01-30 15:56:02","2019-07-03 19:34:04","Ministry of Business Innovation and Employment","Hello Kind Stranger, 

I am hoping to run some kind of analysis on Auckland rent prices? 

Is it possible to get a breakdown of Auckland rental prices - per week or per month or per year and by suburb. The more detail the better. 

If there is a historical (past prices) I would be much appreciated to receive that too. 

Thank you
Richard

","Give me a database to analyse and I will be able to draw some conclusions on the Auckland rental market. ","I am hoping to help write up some research pieces to help Auckland's make more informed decisions around rent so they don't have to listen hearsay. I would do this by conducting some quantitative analysis of the database and present the inferences in a simple way.  ","Agency notified","3","374"
"Household expenditure statistics (HES) 2022","2023-05-03 13:03:28","2024-03-06 11:34:36","Statistics New Zealand","I have found the HES for 2019, but could not find the most recent data set - presumably 2021 or 2022. Can you please forward the latest data set to me. It should be in xl or xls format.","Providing us with impacts arising from living cost increases across different household demographics, in order to help determine the debt servicing buffer that we may need to adopt.","I am looking to consider movement in typical expense values in order to gauge cost of living impacts when assessing consumer credit applications - for debt servicing purposes.","Agency notified","3","897"
"healthcare analytics","2019-03-22 11:54:24","2019-04-09 00:00:17","Health Research Council of New Zealand","data -> csv, xlsx files ","","(1) clear
objective and inclusion criteria; (2) detailed description of sample population and variables; (3) data
source (e.g., hospital, database, survey) and format (e.g., structured Electronic Medical Record (EMR),
International Classification of Diseases code, unstructured text, survey response); (4) valid and reliable
data collection; (5) consideration of ethical issues; (6) detailed discussion of findings and implications;
(7) valid and reliable measurement of outcomes; and (8) use of an appropriate data mining tool for
cross-sectional studies and (1) clear statement of aims; (2) appropriateness of qualitative methodology;
(3) appropriateness of research design; (4) clearly stated findings; and (5) value of research for the
theoretical papers","Agency notified","3","386"
"Auckland Ferry Data","2023-05-06 16:37:34","2023-08-06 02:54:33","Auckland Transport","Hi, Do you have a dataset that contains Auckland Ferry routes, delays, cancellations, historical data and weather reports? I am attempting a miniproject for a Data Science course. If you could point me in the right direction that would be wonderful. Thank you so much!","Using machine learning algorithms to identify patterns and predict future disruptions. This information could potentially be used by ferry operators to make operational decisions and better manage passenger expectations.","I would like these data to use as an example of classification prediction modelling.","Agency notified","3","898"
"requesting list of suburbs with North Island or South Island","2023-05-22 17:29:52","2023-08-06 02:53:37","Statistics New Zealand","Can you please email me a list of all NZ suburbs that includes postcode, city, region and Island? example as below

Postcode Locality	Territory	Region	Island
0110  Abbey Caves	Whangarei	Northland	North Island
","","We have an ERP migration project and need to map the city/suburbs to either North Island or South Island","Agency notified","3","906"
"Request for Prostate Cancer  latest Statistics in NZ ","2021-08-15 12:10:27","2022-10-06 21:52:32","Manukau Institute of Technology","Request for Prostate Cancer  latest Statistics in NZ showing graphs who are mainly affected by age, socioeconomic, location, ethnicity","","I am a student from Manukau Institute of Technology (Manukau) and I am researching about Prostate Cancer. I will be needing the requested data to support my presentation.","Agency notified","3","651"
"List of government agencies are using Agile ways of working in Digital ","2023-05-31 12:33:37","2024-04-12 12:31:18","Statistics New Zealand","as part of our Government Agile research, we require a List of all government agencies who are using Agile ways of working in Digital. ","","This will help to support our findings in analysis and lays a good foundation to justify a move to Agile.  ","Agency notified","3","909"
"Updated List of Accredited Employers","2023-06-06 12:47:16","2023-06-22 18:28:41","Department of Internal Affairs","HI I would like to received an updated list of accredited employers in New Zealand, if this is possible.","The reason is, then if an employer is willing to hire me, then it would be easy for me to obtain a work visa.","I would like to apply for few jobs.","Agency notified","3","915"
"Motor Vehicle Registration ","2023-06-11 19:11:39","2023-08-30 12:29:51","Waka Kotahi (NZTA)","A point-in-time MVR dataset for date ""16/09/2022"" in CSV format. The dataset will represent all NZ registered vehicles at this date. ","Confirming registered vehicles on the Motor Vehicle Register (MVR) following notice of vehicle licence cancellation after 1 year.","Registered vehicles on the Motor Vehicle Register (MVR) for date ""16/09/2022"".","Agency notified","3","919"
"Waahi tapu","2021-10-06 16:55:38","2024-04-12 12:44:33","Heritage New Zealand Pouhere Taonga","Could you please provide dataset that shows all Waahi tapu locations throughout New Zealand? I was able to find dataset only for the Gisborne area.","","Considering culturally important areas to Maori in a research work. ","Agency responded","3","674"
"ACCREDITED EMPLOYERS IN NEW ZEALAND","2023-07-02 16:48:34","2024-03-18 12:06:54","Careers New Zealand","IN OF DATA GENIUNE DATA THAT CONTAINS LISTS OF ACCREDITED EMPLOYERS IN NEW ZEALAND THAT CAN SPONSOR WORKING VISA","GIVING ME AMPLE AND GENUINE INORMATION REGARDING REAL ACCREDITED EMPLOYERS IN NEW ZEALAND WHO CAN SPONSOR WORKING VISA","THE UNAVAILABILITY OF GENUINE ACCREDITED EMPLOYERS' DATA","Agency responded","3","930"
"rock climbing injuries and fatalities","2019-09-20 18:03:40","2024-03-25 20:28:19","Accident Compensation Corporation","Number of injuries and fatalities while rock climbing in New Zealand","","understanding rates of injury and fatalities to assist in educating students studying this sport who will become instructors and lead the public in rock climbing activities","Agency responded","3","422"
"CAA - Part 102 certification application counts","2023-07-27 09:55:53","2023-09-13 14:37:47","Civil Aviation Authority of New Zealand","Would like to know the number of outstanding Part 102 certification applications in the queue with CAA by month going back 3 years, also the average time from application received to certification approval for the same period","Helping the industry design a better process to assist CAA with streamlining the application process - ie: better suited exposition documents","Understanding whether the timeframe for having Part 102 certifications is improving or or getting worse","Agency notified","3","935"
"Noise Induced hearing loss data ","2019-09-27 11:30:54","2022-10-25 14:02:28","Accident Compensation Corporation","Hi,

I'm after a dataset for the last ten years detailing the amount of claims for occupational noise induced hearing loss.

Also if possible can I get annual totals dataset and then a dataset by industry...

Much appreciated.
","","Tertiary education essay","Agency responded","3","424"
"Gisborne Resource Consents","2021-10-20 11:33:03","2024-04-25 10:00:26","Gisborne District Council","I am wanting to download resource consents for the Gisborne Region.  However I cannot find the data on their data portal or this site.  GIS spatial formats in geojson or shapefiles.  The data I would like is similar to the link below

https://data-waikatolass.opendata.arcgis.com/datasets/1ccbf1ee9fe94d9f8c107d4631146ddc_0.csv?outSR=%7B%22latestWkid%22%3A2193%2C%22wkid%22%3A2193%7D 

","","The Gisborne District Council is one of a hand full of council that don't supply this data.  Either through this portal or the regional Councils own data portal.  This data would be helpful to create Water Safety Plans for the GisborneDC.","Agency notified","3","680"
"Playground Accident Statistics","2023-08-14 16:42:04","2024-01-31 13:25:00","Accident Compensation Corporation","we are looking for the statistics of accidents that have happened in Playgrounds. Including information such as, percentage of Male/Female incidents, injury sustained, equipment or area of the playground injury occurred, age range, seriousness of injury etc. ","having this data available means that we can give our clients real life data to encourage potential clients to employ our services, when they do this they are making their playgrounds/ areas safer resulting in fewer injuries. ","We are a playground inspection, repair and maintenance company looking to ascertain some real statistics to show our clients/ tell our clients (current and potential)  as to the reason we do what we do.  ","Agency notified","3","940"
"Fall and claims","2019-11-15 16:41:02","2019-12-16 13:10:27","Accident Compensation Corporation","I would like to have results from falls and number of claims: - month from fall - per year - by age - by sex - severity - from 2000 to 2018 Moreover, the cost from these claims.

","","Contribution to better understanding the Falls in New Zealand and provide preventive healthy programs
","Agency responded","3","439"
"Written Parliamentary Questions","2021-12-10 09:37:03","2023-09-22 14:02:58","Parliamentary Service","Is there an API currently available to read and extract Written Parliamentary Questions, based on existing on-line filters (https://www.parliament.nz/en/pb/order-paper-questions/written-questions/). If so, what are the access requirements and input/output format.","Removing manual processing requirements.","WPQ Ministry of Health requirements","Agency responded","3","702"
"ACC official review outcome statistics ","2019-12-23 02:09:53","2021-06-12 08:22:34","Accident Compensation Corporation","Statistics outlining outcomes for and against ACC within the ACC review process. 

Number of ACC decisions that were contested by patients under official review by percentage of contested cases that resulted in decisions being made by an independent reviewer for or against the view of ACC. ","Making the information transparent and available for further investigation. ","Understanding accuracy and efficiency of initial claims processing by ACC. ","Agency responded","3","450"
"Datasets for teaching, learning, and assessing of Statistics in NZ schools","2023-09-21 11:25:08","2024-05-07 13:27:09","Callaghan Innovation","Aotearoa NZ has a world-leading strand of Statistics in the learning area 'Mathematics and Statistics'. Teachers and students have a huge need for fresh, relevant, clearly curated,  NZ datasets.
These datasets would include:
- case or unit-record datasets, multivariate with categorical and numerical variable
- time series datasets, some with periodic (eg monthly) time scales.
The subject matter and context can be anything that would challenge students, from Year 1 to Year 13. Teachers feel the need most in the senior classes.
Teachers and students would need to save the rectangular dataset as a csv file, so they can open it in software such as https://inzight.nz/ .
Also, they will need metadata with context and details of variables, set of data contributors,  and data sources.
You could look at the 20 resources provided by University of Otago Stats: 
https://new.censusatschool.org.nz/nzsa/ ; Datasets with their NZ contexts – Statistics in Research (2023) 
","Students would experience real data in context. They would 
- practice skills at exploring and analysing it, and they would also 
- meet the issues of data sourcing, data cleaning and editing, data ownership, and data sovereignty. 
These issues are implied in the newly released Curriculum: 
https://curriculumrefresh.education.govt.nz/mathematics-and-statistics

I would like to suggest a conversation about this major opportunity. I hope that this Data Request starts the conversation.

A good start may be a teacher-friendly path into existing datasets.

I've selected Callaghan below because I needed to select someone, but many of those agencies would be appropriate, as country-wide and local datasets will be useful.

If needed, I can supply one piece of feedback from a teacher who has tried using data.govt.","This solves two problems:
- it provides teachers and students with valuable data experiences on relevant and timely NZ contexts
- it provides data.govt with a potentially huge audience of appreciative users, 
   who will take away an understanding of the existence and value of data.govt.","Agency notified","3","962"
"Marine biotoxins monitoring data","2020-01-14 11:41:05","2020-08-30 16:00:36","Ministry for Primary Industries","data on the presence and blooms of the dinoflagellate Alexandrium sp. 
data on paralytic-shellfish-poisoning (PSP) toxins (saxitoxin, neasaxitoxin, gonyautoxin 1-4 and gonyautoxin 2-3)
from the first records to 2020.
data on the PSP warnings released by the MPI, the area they covered and the lenght of the warning.
data on the duration o f the blooms of Alexandrium sp or other PSP-blooms ","The data will be used to show how PSP-blooms have been evolving, their frequency patterns, and how they are correlated with temperature, salinity, dissolved oxygen, nutrients and other environmental variables to build a predictive model with the expected change in environmental conditions and climate for the next 10 years ","This data will be used for research purposes. This data correlated to local environmental conditions could provide a model to predict large scale PSP-blooms that will affect New Zealand aquaculture industry, recreational, customary and culturally harvest of shellfish","Agency notified","3","452"
"P1003 Stewart Island Bathymetry","2021-12-23 11:42:45","2022-07-16 16:48:59","Land Information New Zealand","Raw Bathymetry collected as part of LINZ commissioned hydrographic survey using a singlebeam echosounder in Stewart Island between 30-01-1999 and 01-07-1999.","Obtaining the required Bathymetry Raster data.","Obtaining Bathymetry Raster data for eastern side of Steward Island as required for predictive effects modelling of anthropogenic noise on marine life.","Agency responded","3","708"
"Mental Wellbeing/Health in Tertiary Education","2022-01-20 19:11:58","2023-10-27 21:47:47","Ministry of Education","I would like to enquire whether there is data on students enrolled in tertiary education, their academic performance and mental wellbeing indicators (depression, anxiety, stress etc.). I would like to have the file in an ideal format to clean and sort in R (eg. CSV)","I would like to analyse the data and write an honours' thesis on it.","I would like to analyse the impact of mental wellbeing on students in tertiary education. As COVID-19 has demonstrated, mental health is a serious issue and something that is very important to look into. In particular, students in tertiary education deal with the pressure of academic studies and also societal pressures and understanding more about this will help to look at how policy and university services can help this group of people.","Agency notified","3","713"
"Types of death service – funeral v cremation etc","2014-08-18 21:25:36","2018-01-30 20:10:30","Ministry of Health","Hi there- I would like data at a total level on the above for 2013 or 2012 whatever you can give. Would this be from Department of internal affairs?","","This data is for a research project for one of my clients for one of their clients. They want to understand 3 segments within different ages and need any data on the type of death service if possible.","Agency responded","3","208"
"Property tax delinquencies ","2020-03-04 15:29:21","2024-01-10 07:52:46","Inland Revenue Department","Hi,

I would like to see a list of all properties that have outstanding tax against them. The property addresss and - if possible - the owner's name too.

Thanks,
Tielman","We provide services for property owners who are in trouble with their property. Our services help them structure a solution and plan to resolve the associated issues.","Quite often, people with outstanding taxes have a need for assistance in helping them think about options to resolve the issue(s).","Agency notified","3","464"
"New Zealand General Social Survey CURF","2014-09-10 05:00:08","2018-04-18 00:01:39","Statistics New Zealand","2008, 2010, 2012 in Excel would be ideal. We are most interested in the volunteerism and political participation by region. ","","understanding the effects of the Canterbury earthquakes on civic engagement. ","Agency responded","3","210"
"nodal elelctricity demand ","2014-09-27 10:29:18","2018-04-18 00:01:26","Electricity Authority","i need hourly data from 2000 to 2013","","my PhD thesis about electricity market in NZ","Dataset already listed","3","214"
"Myocarditis rates 2021-2023","2023-11-17 20:29:13","2023-12-19 21:29:24","Ministry of Health","Request for data regarding myocarditis hospital admission rates, this being separated by week and age, ideally in CSV format","being able to analyse it alongside vaccination rates","this would solve the problem of comparing these rates against the vaccination rates, which I'd like to do analyse the weekly trends and separate by age","Agency notified","3","982"
"Comprehensive Traffic, Weather, and Air Quality Data for Auckland","2023-11-28 14:53:20","2023-12-04 15:14:14","Auckland Transport","We are requesting non-personal, non-secure datasets related to traffic flow, weather conditions, and air quality measurements in Auckland. Specifically, we are interested in:

Detailed traffic data, including vehicle counts and congestion levels, preferably segmented by time of day and location.
Historical weather data encompassing temperature, humidity, wind speed, and precipitation.
Air quality data, including measurements of pollutants such as PM2.5, PM10, NOx, and CO2 levels.
We are seeking data for the period from 2015 to the present to observe long-term trends. The preferred formats for this data are CSV, Excel, or any other machine-readable format that allows for detailed analysis.

","Allowing us to analyze the correlations between traffic patterns, weather conditions, and air quality. This analysis will enable the development of a predictive model to forecast air quality, helping policymakers and the public make informed decisions. Opening this data also supports academic research and contributes to the global understanding of urban environmental challenges.

","Inadequate understanding of the factors affecting air quality in Auckland and the inability to predict changes effectively. This data is crucial for academic research aimed at developing predictive models to forecast air quality variations, contributing to public health and urban planning initiatives.

","Agency notified","3","986"
"Number of employees at public sector organisations","2023-11-28 14:55:26","2023-12-08 11:07:19","Public Service Commission","A full account of the number of employees (Full Time Equivalent) that each public service organisation in Aotearoa has reported for each financial year. The data could be collected at the end or at the beginning of each financial year, e.g. the 30th June or the 1st July. Use the definition that the PSC provides as to which organisations are part of 'The Public Sector' https://www.publicservice.govt.nz/system/system-architecture-and-design/how-the-public-sector-is-organised/

The data should go back 10 years from now, so from 2013 to be able to see developments over time and be presented in an Excel sheet, either as one combined file or as one file per organsiation. ","Providing full transparency for everyone n New Zealand, and for academics and researchers specifically who want to track and understand the developments of public administration through on data.","Transparency and certainty what the number of employees of public sector organisations really as, as this is a hotly debated topic at the moment. Showing it over the last 10 years and for different organisations allows for more nuanced research and analysis of how staffing numbers have truly developed, and in what functional areas developments may have differed. ","Agency notified","3","987"
"Respite","2022-03-16 13:51:44","2022-12-18 13:01:40","The Treasury","We would like information about Respite funded in the community in Tairawhiti through any source, Oranga Tamariki, Health, ACC, MSD
Who receives funding?
How much?
What for? What do they provide? any criteria that applies?
Referral pathways?","Identifying providers, their capacity 
Providing information to Manaaki Tairawhiti Governance Group about current community resourcing.
","We don't know who is funded to provide respite.
We don't know what types of respite are funded and should be available in our community

","Agency notified","3","733"
"Covid - 19 Surveillance tests","2020-05-05 21:28:25","2022-08-08 07:01:58","Ministry of Health","Numbers of Covid - 19 tests for surveillance purposes by region and date as well as the number of positive surveillance tests by region and date from when testing first began.
","","This data would provide a better idea of the real risk of transmission of Covid-19 for an individual in a community","Agency responded","3","485"
"Workplace accidents while under influence of drugs/alcohol","2020-06-04 11:34:37","2023-09-09 10:27:14","Accident Compensation Corporation","Can you please provide me with some statistics on accidents in the workplace when the person is affected by alcohol and/or drugs? Ideally this would include time of day incident occurred, month, age, gender, type of workplace (industry - e.g. forestry, trucking etc), severity, and costs from 2010 onwards. 

","We are developing a tool to measure levels of alertness, with the aim of reducing accidents in the workplace. Having this data would establish the need for such a tool.","We are developing a tool to measure levels of alertness, with the aim of reducing accidents in the workplace. Having this data would establish the need for such a tool.","Agency notified","3","493"
"Deaths and Accidents caused in NZ by International Drivers","2015-03-19 13:20:20","2015-04-23 23:51:56","New Zealand Transport Agency","Seeking the following pieces of data from 2010 - 2015 regarding deaths and accidents caused on NZ roads by International drivers if available:
<ul>
<li>Location of accident (region of occurrence)</li>
<li>Average age and nationality of driver</li>
<li>Deaths per year caused by international drivers</li>
<li>Accidents per year caused by international drivers</li>
<li>Ages of those that were harmed or killed by international drivers</li>
</ul>
","","Working on an assignment for my Bachelor of Applied Business Studies paper and need a reliable source.","Agency notified","3","239"
"Electoral Boundaries","2020-06-16 10:21:21","2023-07-20 11:41:27","Electoral Commission","A geographic overlay of each of the electoral boundaries that can be used for data comparison purposes","Enabling organisations to map their resources by electorate so that the stakeholder group can liaise with the member of parliament on an informed basis","Being able to align community resources or needs and the appropriate member of parliament. ","Agency responded","3","497"
