"Title","Created","LastEdited","Agency","Description","ProblemBy","ProblemOf","Status","Votes","ID"
"Accredited Employer AEWV - including Accreditation Type","2023-09-03 15:54:44","2023-10-20 16:00:53","Ministry of Business Innovation and Employment","Accredited Employer is available on the Immigration NZ website with NZBN and Accreditation expiry date but I would also like to know the Accreditation Type i.e. Standard, High Volume, Franchisee or Controlling Third Party.","publishing the Accredited Employer Accreditation Type","There are different requirements under some of the Accreditation Types. Releasing this data would enable employees, franchisors and Controlling third parties to check the correct Accreditation type has been applied for and granted.","Agency notified","1","954"
"End Use data set","2023-09-04 15:30:20","2023-09-08 14:05:27","Energy Efficiency and Conservation Authority","Please provide all data available on the use of electricity between industry sectors. If the industry sectors do not directly align to the ANZSIC classifications, is it possible to get the mapping table for how the end sectors relate to ANZSIC'","","Accounting for scope 2 emissions for the purposes of emission reporting for financial institutions","Agency notified","1","956"
"Interpreter Service Use in Public Health Care","2023-09-18 07:53:28","2023-10-27 21:42:00","Te Whatu Ora - Health New Zealand Te Toka Tumai Auckland","Please can you publish the cost of Interpreting Services to Te Whatu Ora by district and language and department of use.","This will help understand what resources need to be provided to the public in what languages in what settings. 
This will help to determine where the need for what language interpreters are around the country.
This will help as an indicator of complexity in understanding the health needs of people across Aotearoa.","Understanding the areas of need across Aotearoa of interpreting services and in what context.  Using an interpreter it time consuming for health professionals and delays care because an interpreter has to be booked and then arrive.","Agency notified","1","960"
"Injuries related to flooding","2020-01-20 16:31:50","2023-09-06 15:21:55","Accident Compensation Corporation","Are you able to provide your most recent ACC statistics regarding claims related to flooding in NZ? i.e How many claims were made in 2019? How many claims were made in 2019 compared to previous years? ","providing the information necessary to advise both the public and companies on how best to proceed in the face of rising flood risk ","examining current flood risk to New Zealanders and how that might look in the future, especially in the face of climate change and increasing extreme weather events","Agency responded","1","454"
"Postcodes, regions and towns (suburbs)","2023-10-12 13:07:09","2023-11-21 15:26:50","University of Otago","All postcodes in NZ, with regions, towns and suburbs, saved in a CSV file","","I am a researcher at the University of Otago and it will help design surveys in Qualtrics when asking respondents for their postcode and region. The more efficient surveys are presented to respondents, the more likely they are to complete the survey.","Agency notified","1","966"
"Greater Wellington Regional Council survey data of indigenous birds of the Wellington region coastline","2020-01-22 07:46:55","2020-02-03 16:03:35","Greater Wellington Regional Council","Survey data in a Microsoft Excel™ spreadsheet used to produce the report ""A baseline survey of the indigenous bird
values of the Wellington region coastline"". See page 6 of this report <a href = ""https://www.gw.govt.nz/assets/Our-Environment/Environmental-monitoring/Environmental-Reporting/Wellington-coastal-bird-survey-report-July-2019-v4.pdf""> https://www.gw.govt.nz/assets/Our-Environment/Environmental-monitoring/Environmental-Reporting/Wellington-coastal-bird-survey-report-July-2019-v4.pdf </a>","At present those data are difficult to access easily. A member of the public would have to write in to the Greater Wellington Regional Council and request it. Such datasets may not be easily findable in 5 years time. It was only as a result of reading the report based on those data that I realised it might be possible to access the data the report was based on. By having those data available on data.govt.nz it would be more discoverable to everyone. I would also be able to use the link generated by data.govt.nz to cite the data. ","I would like this survey data to be kept secure and publicly available. This survey is recommended to be repeated every 5 years. If the survey data for each subsequent survey is kept in a public repository data analysis can be undertaken by member of the public comparing the data and indicating the decline or recovery of species at specific sites in the Wellington region. Without the raw data being kept in a public, easily accessible and secure place, this type of analysis would be challenging to be undertaken by interested parties. ","Agency responded","1","455"
"Water use (water demands) records","2022-01-26 03:12:05","2022-01-30 07:51:51","Statistics New Zealand","Information: Water demands, withdrawals and consumption from sectors like irrigation, livestock, households, manufacture and thermoelectric power plants.
Spatial scale: Regions/States or national level.
Temporal scale: finer resolution possible (monthly) since 1980 onward.
Format: Information in spreadsheet (.xlsx) or text file (.txt or .csv) format.","To build process understanding of how sectoral water use behaves during drought-heatwave events. It is expected to gain insight of sectoral competition and to identify specific regional patterns that can be later associate with socioeconomic indices.","The development of an updated global-scale sectoral water use model which will help to analyse water scarcity under droughts and heatwaves.","Agency responded","1","714"
"Data quality","2023-10-26 20:30:14","2023-11-07 08:36:50","Wellington Institute of Technology","my intention is to first measure data quality metrics and find free tools to prepare scorecards based on measurements.","","will help comprehensive research and validate sources to use.","Agency notified","1","970"
"Spinal pain in adolescents  ","2022-01-30 20:19:40","2022-10-08 20:22:04","Accident Compensation Corporation","Cervical /thoracic /lumbar spine claims in under 20 year olds by year 2001 to 2021","If there is a link shown then actions can be taken through education and other means ","Assessing whether smart phone and device use and sedentary lifestyles are having an increasing effect on spinal problems in adolescents ","Agency notified","1","716"
"NZ Citizenship 2021 vs. Prior 3 years","2022-02-01 16:56:30","2023-11-05 21:41:34","Department of Internal Affairs","Minimum, median and maximum time to process application from received to granted or declined status.
Citizenship volume granted.
Citizenship volume applied.
Nationality and Country of applicant.

","Providing data for analysis of trends and application processing efficiency, for public information.","Lack of accessible current data for immigration and emigration decision-making.
","Agency responded","1","717"
"Voting statistics 2023 election","2023-11-08 04:30:03","2024-03-06 12:30:36","Electoral Commission","Enrollment and voting statistics (at national level and by electorate) in CSV/XLSX form","","Academic research","Agency notified","1","975"
"New Zealand Suburb, postcode, region, Province database","2022-02-04 12:00:57","2022-03-11 16:02:22","Auckland Council","We are building our database with NZ suburb, postcode, region, Province.  If possible please include City and Street names in the database. 
","As mentioned above","building our database with NZ suburb, postcode, region, Province to analyze our customer's location","Agency responded","1","720"
"Number of recipients of regular social welfare payments","2022-02-08 19:08:21","2022-02-13 12:35:18","Ministry of Social Development","Kia ora,

I would like to request the total number of recipients of regular social welfare payments as a topline sum followed by a break down by type of welfare payments and the sum of recipients. Eg. Super, unemployment, disability, ACC, WFF etc. Better yet, provide this table on a monthly or quarterly basis.","Being transparent.","Not being able to find this data without spending hundreds of hours worth of time doing research and corresponding with a dozen different agencies.","Agency notified","1","721"
"Kaimaumau c2 block","2023-11-09 18:13:16","2023-11-20 20:46:17","Far North District Council","Encroaching hydro parcel on maori freehold land the boundary which is considered by council as a public road or paper road.","Council have taken the land without permission from the owners to establish a access road which currently which there road is under water.","This would solve the problem of who own the road which has been taken from maori freehold land without permission from owners.","Agency notified","1","978"
"injuries in forestry - ACC ","2022-02-13 22:43:09","2022-03-10 11:44:31","Accident Compensation Corporation","number of claims for forestry related accidents 2014 -2021
by ethnicity
by cost
by geographic location 
fatalities","","research into cost of forestry injury in NZ ","Agency responded","1","724"
"Not in Education, Employment or Training - NEETs","2014-10-10 09:24:15","2015-10-19 12:29:51","Tertiary Education Commission","Can you provide me with the most updated information of NEETs within  Auckland only.  ","Stating exactly how many young people were recorded within Auckland as NEET.","Understanding how many young people within Auckland are not in employment and education or training.  ","Agency responded","1","215"
"8/03/2022","2022-03-08 10:15:50","2022-03-16 06:39:00","Ministry of Transport","Porsche Motor Cars registered in New Zealand 2000- 2022. Record to include. Date of first registration. Model. Model Year. Registration Number. First Owner. Last Owner.","Fill in the gaps obtained from other sources.","Researching Porsche Cars in New Zealand to assist in an essay title, ""Porsche in New Zealand.""","Agency notified","1","728"
"Significant Natural Areas","2023-11-28 10:22:22","2024-03-06 12:30:10","Far North District Council","identifying significant natural areas in Far North District Council area.","Knowing and identifying the significant Natural Areas in Far North District Council area.","Esri ArcGIS","Agency notified","1","985"
"different types of New Zeland National Road ","2020-04-12 10:58:39","2021-05-11 15:52:49","NZ Transport Agency","this data identifies road hierarchy like local street main street and arterial road and that good to uses when it urban planning. 

file on shapefile ","for the business to plan the travel and distant that could also be helpful to use the map to help the truck drivers.  ","this would solve for how to plan delivery trucks in the area and also where truck can't go in the area. ","Agency responded","1","476"
"Concussion/mild traumatic brain injury statistics","2020-04-27 14:02:58","2023-03-31 12:49:50","Accident Compensation Corporation","If possible I would like a summary of concussion/mild traumatic brain injuries between 2010-2020 broken down into how the injuries occurred and a breakdown of which ethnic groups suffered the most of these injuries while playing sport ","","It is relevant data for a university project that I am writing ","Agency responded","1","483"
"Rainbow data","2022-04-05 12:15:37","2022-07-21 13:43:29","University of Auckland","A request for statistics of LGBTQITakatāpui+ (Rainbow) students and staff, by faculty/degree. Further, a request for how the data is currently being used.","","Data inequities of collection and use - students and staff are asked to tell the University whether they identify as rainbow, yet this data  is not shared. If we are being asked to provide our information, we should be able to get it back (albeit in aggregation).","Agency notified","1","739"
"average daily temperature data","2022-04-19 02:12:12","2023-07-03 14:22:41","National Institute of Water and Atmospheric Research Limited","Average daily temperature data for Aukland for January, February, and March","Providing the exact data from which to evaluate the temperatures during this period ","Understanding temperature and fluctuations during this period","Agency responded","1","740"
"Claims of people with a disability that had an accident on a footpath","2020-05-07 07:49:07","2020-05-27 17:03:30","Accident Compensation Corporation","I want to find out how many acc claims there were from people that have a disability and had an accident on a footpath. Either caused by cyclist or an (e)scooter.","Have clear data for people voting for or against the NZTA’s proposal for the innovating streets package.","This will actually help with NZTA’s proposal for the innovating streets package.","Agency responded","1","486"
"Rail Distances km","2023-12-05 16:08:29","2023-12-28 16:33:04","New Zealand Railways Corporation","I please need to view the distances by rail to help calculate Carbon Emissions,
Specifically the distances from;
Spring Creek to Picton
Wellington to Metroport in Auckland 
Wellington to Hastings
Hastings to Metroport in Auckland

Thank you!
","","Please see above, relates to Carbon Emissions reporting","Agency notified","1","998"
"Rape/sexual violence claims acc","2020-05-08 18:00:25","2022-12-19 12:41:43","Accident Compensation Corporation","Can I please have numbers on rape/sexual violence sensitive claims through ACC 2018-2019 and how many Confirmed diagnosis of PTSD as a result of rape/sexual violence at ACC","","This request is for a research paper at Massey University written by me (a student) discussing the rehabilitation steps for someone navigating the sensitive claims unit. I cannot write my paper without some statistical data ","Agency responded","1","487"
"Urgent inquiry about data on regional energy use in New Zealand","2023-12-11 11:48:02","2024-03-01 07:03:43","University of Auckland","Hi Officers,

I would like to inquire if your organization has data on regional energy use in New Zealand, including Northland, Auckland, Waikato, Bay of Plenty, Gisborne, Hawke's Bay, Taranaki, Manawatū-Whanganui, Wellington, Tasman/Nelson, Marlborough, West Coast, Canterbury, Otago, and Southland. 

Specifically, I would like to inquire:
(i) Does your organization have data on energy use by region in New Zealand from 2007 to 2021 or a partial time slot?
(ii) If the answer to the first question is no, does your organization have relevant raw data that I can compile for regional energy use data? For example, regional energy use from different sources including liquid, gas, solid fuels, and so on.
(iii) If your organization does not have relevant data, then what organizations may I turn to for help?","These data will be processed by several quantitative methodologies, for example, the econometric method for non-commercial purposes. Before we publish our research results publicly, we will inform the relevant institutions about our specific processes for handling these data.","For research purposes，these data will be used to analyze the significant impact of energy use on carbon emissions in all New Zealand's regions. My supervisors and  I firmly believe that this research is blank but important for New Zealand to achieve carbon neutrality. However, I have not been able to collect it by any means.
","Agency notified","1","999"
"Canterbury mudfish and Longfin eel distribution dataset","2020-05-21 15:51:24","2020-05-25 10:09:18","National Institute of Water and Atmospheric Research Limited","Hi, iam in need of distribution spatial dataset of Canterbury mudfish and longfin eel . Iam using it for my GIS project. It should be in excel and shape format. Distribution for the above two fishes for Canterbury region, nz","","Iam in need of this data to do my project and can create a report that helps to create effective plans to protect these species","Agency responded","1","489"
"NZ Aerial Photos","2023-12-19 13:58:40","2024-01-10 18:00:50","Land Information New Zealand ","Hello, I'm looking for NZ Aerial Photos that were published as part of the GovHack Challenge 2020 - Solar Panel AI: How can we encourage citizens and businesses to move to cleaner energy?
It doesn't seem to be available anymore on the page. I would like to use it for my Master's thesis. 
","Making the aerial imagery accessible for training computer vision models. ","Solar AI solutions that utilise computer vision to understand best use of rooftops for solar installations. ","Agency notified","1","1002"
"SME Injury Data 2017-2019","2020-05-27 15:48:31","2020-06-17 14:28:13","Accident Compensation Corporation","Please can you provide a break down of claims made for employees/employers of small and medium sized businesses, including industry, geographical location, injury type, injury description, month, whether it was a fatality, lost time injury or medical treatment injury.","Businesses that are exposed will understand the risks and injuries that are associated with thier industry, and be motivated to put controls in place with support and guidance. Statistics will significantly help with this.
","To understand clearly the workplace claims associated with small and medium businesses. To work with these specific business to eliminate or reduce their likelihood of injuries, particularly serious injuries resulting in lost time and fatalities. ","Agency responded","1","491"
"Nz post delivery days","2023-12-23 23:22:21","2024-01-10 21:09:17","New Zealand Post Limited","I’d like a fairly simple feed that provides what days of the week mail is delivered to a particular address or geo location","Allowing me to display mail deliver dates in an application I’m making","Knowing when mail will be delivered","Agency notified","1","1005"
"Accidents in Workplace (time of day they occurred)","2020-06-04 11:40:14","2020-06-22 15:07:14","Accident Compensation Corporation","Can you please provide me with some statistics on accidents in the workplace caused by fatigue? We specifically would like to know the time of day the accident occurred.  Type of workplace (industry - e.g. forestry, trucking etc) severity, and costs from 2010 onwards.  (We submitted a similar request a couple of months ago, but need time of day the incident occurred added to it).
","We are developing a tool to measure levels of fatigue, with the aim of reducing accidents in the workplace caused by fatigue. Having this data would establish the need for such a tool.
","We are developing a tool to measure levels of fatigue, with the aim of reducing accidents in the workplace caused by fatigue. Having this data would establish the need for such a tool.
","Agency notified","1","494"
"Areas Susceptible to Coastal Instability and Erosion (ASCIE)","2022-05-24 11:49:59","2022-06-27 12:45:57","Auckland Council","The Auckland region has a high exposure to coastal hazards including coastal instability and erosion. These hazards can present a safety risk, adversely affect property and infrastructure, and damage or destroy cultural and environmental sites. A program of research has been undertaken to identify, at a regional level, the Area Susceptible to Coastal Instability and/or Erosion (ASCIE). ASCIE is the area landward of the current coastline that is at risk because of coastal erosion or instability caused by coastal erosion. The study forecasts the areas of Auckland’s coastline that could be affected by coastal erosion and instability under a range of climate change (sea-level rise) scenarios and timeframes.


This data is mapped at a 0.5 km to 5.0 km scale and is not intended for site-specific use other than to determine whether more detailed study is warranted. Due to the large scale of the assessment (i.e., 0.5-5 km resolution) errors are inherently introduced due to the variance within a coastal cell. To identify areas that could potentially be susceptible to coastal instability and/or erosion typical upper bound values have been adopted for each coastal cell. This means that in some areas the ASCIE may be overpredicted (i.e., shown further landward). However, this also means that in ASCIE may be underpredicted in areas where values are larger than the typical upper bound value (i.e., the largest or maximum values). Therefore, this assessment is recommended to be used as a preliminary tool. The regional-scale ASCIE can be refined by undertaking an assessment on a more detailed scale.
The purpose of the ASCIE identified within this ‘first-pass’ assessment is that they represent land potentially susceptible to coastal erosion and/or land instability associated with this erosion at a regional scale for present day conditions and a range of possible future climate change states. This means the areas outside of the identified ASCIE may be considered unlikely to be susceptible. It should be noted that this ‘first-pass’ assessment has been undertaken at a high level (regional scale) and may be superseded by local (Level B) and site-specific (Level C) scale assessment by a suitably qualified and experienced practitioner.

This ASCIE mapping should not be used for the assessment of the erosion susceptibility of individual properties. As a ‘first-pass’ assessment it may include significant inaccuracies at localised levels. Assessment of individual properties (e.g. for consenting, valuation and insurance purposes) should be based on a site-specific (Level C) geotechnical assessment prepared by a suitably qualified and experienced practitioner.


Public release is available for this dataset under a Creative Commons license","making sure data is accurately represented and when AC review Coastal Hazard Assessments, they can be sure the data is valid and accururate.","Being able to apply or incorporate this data into GIS software for the purpose of accurately comparing regional scale assessments (Level A) with site specific (Level C) assessment for Coastal Hazard Assessments.

The note on the AC Geomaps states that the data is available....""Public release is available for this dataset under a Creative Commons license"" but there is no download link at the folllowing  https://catalogue.data.govt.nz/organization/auckland-council?license_id=CC-BY-4.0

Please make this regional scale assessment data available. or even just send to me! please!","Agency responded","1","750"
"Geodatabase for Christchurch","2022-05-30 00:44:34","2022-07-31 12:16:09","Lincoln University","Hi I need a Geodatabase for Christchurch Bus Routes, Christchurch roads, Christchurch Zones having GDB file","","I am doing a study project for my studies where i would be recommending a school or foodlet so i need data.","Agency notified","1","752"
"Family court  fgc ","2024-01-10 15:15:24","2024-01-11 00:03:18","Guardians of New Zealand Superannuation","Family service that I can get formation on service available to help get information on f.g.c ","","Getting the right information","Agency notified","1","1010"
"NZ Memorials register","2015-05-05 09:36:33","2015-07-02 08:22:11","Ministry for Culture and Heritage","Currently at http://www.nzhistory.net.nz/culture/the-memorials-register as KML file. Please add a metadata entry at data.govt.nz and ideally offer the data as GeoJSON as well as KML.","","Discoverability","Agency responded","1","244"
"Raw material for manufacturing","2022-06-19 21:29:20","2022-06-23 22:34:00","Ministry of Business Innovation and Employment","With logistical challenges for NZ Manufacturing, data on local and imported sources will become increasingly important.
For example the ferro-alloy world market is projected to be worth USD 187.25 Billion by 2030, registering a compound annual growth rate (CAGR) of 5.6% during the forecast period (2022 - 2030).
  ","Identifying competitive alternatives","Maintaining continuity of steel manufacturing","Agency notified","1","758"
"Historical public holidays back to 1980","2015-07-04 17:09:55","2023-07-04 15:30:26","Ministry of Business Innovation and Employment","Hi there. It's easy to find out when public holidays were or will be observed, for 2001-2021: http://employment.govt.nz/er/holidaysandleave/publicholidays/publicholidaydates/index.asp

Can you please also make available the historical observed dates of public holidays going back to 1980? Surely somebody wrote these down somewhere for employment compliance purposes, and can make them available digitally.","Saving individuals and organisations the effort of asking every regional council the same question, and combing through newspapers for confirmation.","For reporting of historical productivity or financial performance, it is important to know which days people weren't working and banks/sharemarkets were closed.

Currently, there is no discoverable digital source of this information back in time, beyond 2001.
","Agency notified","1","249"
"High and Low temperature in Christchurch from 1948","2024-02-01 09:29:51","2024-03-15 10:23:31","Ministry for Environment","My wife and I are looking at making a temperature craft project for my Mother In Law that uses the daily high and low temperatures. I was wondering if we could obtain the data from the start of  1948 to the end of February 1948. We would like the city of Christchurch as that is where my mother in law was born and raised. ","","Having the data to make a hand made gift for my mother in law","Agency responded","1","1020"
