"Title","Created","LastEdited","Agency","Description","ProblemBy","ProblemOf","Status","Votes","ID"
"Deaths by all Cause Mortality for New Zealand","2022-08-25 15:53:23","2024-04-13 20:14:51","Department of Internal Affairs","Deaths by all causes for each year or part year (shown  by comparative year ) for the years July 31st  2017 to July 31st 2022 - current 
showing deaths by :
Year
Age
Gender 
Cause ( as reported on  death certificate )
Sub Cause  - Suicide, Death by accident  - self inflicted,  Death by accident - motor vehicle, other deaths (specify  the class of ""other "")
Death Certificate  authored by  - list by  Doctor , pathologist, Coroner , NZ  Police , specified other 

i would like in a Microsoft excel format  please ","The Office of the Chief Coroner refusing to make summary deaths cause data available  by Judicial privilege.","Explaining the unexpected increase in all cause mortality , that is not explained deaths ""By"" or ""With"" Covid ","Agency responded","2769","777"
"All postcodes","2019-10-22 16:31:57","2024-05-17 13:28:02","New Zealand Post Limited","List of all NZ postcodes, name of suburb associated with the postcode, along with associated geographic shape of the postcode area (in WKT form ideally) - all available to be downloaded into a single CSV file. Having the total population within each postcode would be a bonus.","Having a clear and complete set of postcodes that is easily accessible, and can easily use for analysis in bulk.","Currently it is difficult to identify which NZ postcodes exist, and what area they cover. At the moment, the only source of NZ postcodes seems to be a series of PDF files, which are difficult to run analyses on.","Agency responded","652","433"
"Updated List of Accredited Employers","2022-08-27 21:54:15","2024-05-19 22:23:21","Ministry of Business Innovation and Employment","Name and careers website of employers who completed their application for the Accredited Employer Work Visa (AEWV) scheme by sector","increasing the awareness of migrant workers with temporary visa and their knowledge of potential employers who could sponsor for work and possibly extend their length of stay in New Zealand. This would also help the migrant workers verify if the employers offering them permanent job offer are indeed accredited.","Previously, the list of accredited employers was published in the NZ Immigration website. However, when the AEWV scheme was launched, the list was no longer available.","Agency notified","636","780"
"Property & Rating Valuation Data","2011-04-06 12:59:33","2024-05-04 08:39:49","Quotable Value Limited","Data relating to properties in New Zealand - Rating Valuations, Construction Materials/Date, Floor/Land Areas, Legal Descriptions & Title numbers","Allowing Open Govt advocates to build a simple, openly accessibly API to this data for the aforementioned services.","Allowing Kiwi companies to build innovative services utilizing this data, or interesting views on this data - especially given that it is relevant to a large proportion of home-owning New Zealanders. Consider something like http://mashblock.co.nz, for instance.","Agency responded","178","3"
"Vaccine Injury compensation ","2019-08-30 11:01:03","2024-05-06 17:05:25","Accident Compensation Corporation","I would like to know the total number of claims both declined and accepted by acc since acc was established, as well as the total moneys paid out to successful claimants. ","Providing assurance to parents hestitant to vaccinate for fear of injury. ","Providing evidence that our government agency looks after those negatively effected by vaccines, to boost confidence in vaccinating. ","Agency responded","163","419"
"New Zealand national and local holidays calendars","2014-01-20 10:06:03","2024-04-16 16:39:38","Ministry of Business Innovation and Employment","Please make available iCalendar (.ics) files of New Zealand national and local holidays. 
Note this was previously available but the link no longer works.  e.g. 
http://www.dol.govt.nz/er/holidaysandleave/publicholidays/publicholidaydates/ical/public-holidays-national.ics","","Being able to automatically schedule computer jobs for one of my clients, without them having to maintain their own calendar file.","Agency responded","157","182"
"Accident blackspot","2013-10-30 16:26:08","2020-06-02 23:03:15","Ministry of Transport","Request accident blackspots with accurate Latitude and Longitude. Data format call be CSV or whatever it suit.","","That would help on improving road safety.

","Agency responded","147","175"
"MP Voting Record","2014-05-12 18:45:06","2024-04-12 13:02:46","Office of the Clerk of the House of Representatives","I would like a publicly searchable database to be created or made available, that lists how each member of parliament votes (yes, no, abstain) in each occasion that they are required to vote. 
or at least a spread sheet with this information.
It should list each required voting opportunity and how each mp voted and a date. ","it would enable the public to make an informed decision who to vote for, because people would be able to easily see what each MP/ party actually believes and stands for and if they have high integrity and can they be trusted to fairly represent the majority view of their constituents.
I know that I could attend a meeting to get to know an MP, but that is an old world method of information dissemination, in this new world of information technology a public website devoted to providing this info/tool could dramatically increase voter turn out, and lead to a fairer more democratic result. 
After all MPs are elected to represent, so they should provide detailed info on how they are representing, so that constituents can  ""hire or fire"" those MP's for not meeting their KPI's in the next election","presently I personally have a lot of trouble deciding who to vote for or which party to vote for, because I do not know the mp and some of the actions parties make are not decisions I agree with. I expect a lot of other people share my dilemma. I am nearly at the point of abstaining from voting due to lack of trust. 
So providing this data to the public (updated daily) would allow the public to begin to know and trust (build confidence in) the MP's and their Parties based on being able to see how they vote and how that is aligned with individual voters views. It would be much like the system Trade me use where you get to leave feedback on each others accounts which enables trade me members to know whether the trader has good or poor trading integrity.","Agency responded","116","192"
"NZ Localities","2011-04-06 14:03:18","2021-01-18 10:01:01","New Zealand Fire Service Commission","Datasets managed and maintained by the New Zealand Fire Service that related to 'localities' e.g. cities and towns, as well as suburbs and other means of identifying location. The data is currently available for free under restrictive license terms. All that is needed is a change in licensing to support the release of NZ Localities under a license compatible with the NZ GOAL framework.","The NZ Localities dataset is partially open, but its use  limited under a restrictive license. All that is being asked is for the license to be changed to a Creative Commons license that is compatible with NZ GOAL.","Other than the Statistics NZ Digital Boundaries (regions, TAs, mesh blocks, census area units) there are no commonly defined units like suburbs, cities and towns. This has many geospatial applications for business, non-profits, and even recreational uses.","Agency responded","103","4"
"New Zealand Parliamentary Votes","2011-10-04 16:31:36","2024-03-06 16:38:56","Office of the Clerk of the House of Representatives","Data set containing all bills voted on by parliament, recording details of the issue/bill (date, name, abstract, URL to more data, etc.) which MPs voted and which vote (aye, nay [abstain?]) they each cast.

I'm not sure if it's easier to try and collate this on a per-bill basis, or a per-MP basis.","Giving flexible access to raw voting record data to the general public","Analysing MP voting records and parliamentary voting statistics.","Agency responded","99","57"
"MP voting records API","2014-04-18 17:26:57","2024-04-12 13:03:03","Office of the Clerk of the House of Representatives","An API (XML and/or JSON) of which MPs have voted yes/no/abstained at each reading of each bill. Information is currently available in Hansard but this is not machine-readable. The API should be updated as close to real-time as possible - eg when the debates are put online.","Allowing websites to automatically track voting records without having to manually trawl through Hansards to extract data by hand.","Providing transparency of MPs' voting records, enabling better engagement with MPs on legislation of interest.","Agency responded","99","189"
"Walking Access Data Vector Download","2012-09-06 01:39:10","2017-04-05 08:52:03","New Zealand Walking Access Commission","Vector polygon download of the various layers available at wams.org.nz

That site is a great tool, and recent upgrades include a mobile app, but many of the publicly accessible areas are outside of 3G cell coverage, defeating the purpose of the real-time mapping app.

The vector polygon datasets of publicly accessible areas could be offered as a download, hosted at Koordinates.com, data.linz.govt.nz or somewhere similar.","Allowing a vector dataset download will allow opensource developers to create mapping products that can be stored on tablets, smartphones and GPS receivers, enhancing access to the data for end users (by not requiring a mobile connection for a realtime feed from wams.org.nz), and therefore enhancing access opportunities to the public access areas, which is the overall goal.","requiring a live internet connection to access the information on a portable device, i.e. smartphone with GPS.","Dataset added","94","114"
"Bulk sale price data for individual houses","2014-05-15 17:35:35","2024-02-19 14:07:41","Ministry of Business Innovation and Employment","Bulk sale price data for all house sales in New Zealand, along with any other supporting data e.g.: method sold (auction/etc), number bedrooms, bathrooms, size sqm, land size etc.

This data should be available as a bulk feed/API, supporting historical queries and returning all available data.","giving access to house purchasers, through direct access or publication by any interested party.","Having access and being able to easily find house sale price data for a variety of analysis and visualisations. House purchasers have little access to compare the histories of house sales without paying significant amounts of money.

Other countries have much better access to this data than New Zealand (e.g.: Zillow in the US) for free. This data is part of the public record and allowing bulk access will bring NZ into line with other countries.","Agency responded","83","195"
"Building Occupancy (Commercial, Residential, industrial)","2013-10-18 22:36:14","2021-05-31 11:08:51","Ministry of Business Innovation and Employment","Looking for building occupancy information. (Commercial, Residential, industrial)","Help in understanding the distribution of exposures","This would solve creating industry exposure data development","Agency responded","82","174"
"2013 Vehicle Volumes","2013-11-28 11:39:17","2018-05-16 10:28:49","New Zealand Transport Agency","Total vehicle registrations as at March 2013.
Makes and models of vehicles registered
Average age of motor vehicles
Vehicle numbers by city breakdown","","To enable specific target marketing of products","Agency notified","82","178"
"New Zealand Active Faults Database","2011-04-11 12:58:41","2023-07-05 22:10:45","Institute of Geological and Nuclear Sciences Limited","GNS Science maintains the New Zealand Active Faults Database. This database has been designed to hold all data collected from investigations of active faults.","By releasing the underlying geospatial data contained in the Active Faults database, this would enable community groups and businesses (and likely others) to mash up their data with the active faults database and better understand some of their generalised earthquake risk.","Currently the active faults database is 'locked' behind a web map and form. It is not possible for businesses or community organisations to extract the data and overlay it with their own geospatial data - such as a map of their business assets.","Agency responded","81","14"
"Workplace Injuries and Deaths","2013-12-02 16:22:35","2015-10-19 10:50:48","Statistics New Zealand","Could the Department of Labour or ACC please provide current (2013) historical data on workplace mortality and injury rates by sector.

Please provide data in both XLS and API (XML / JSON) formats","Allowing better reporting and analysis of performance against known rates.","Better visibility and trends analysis on national occupational health incidents / hazards and how individual sectors, regions or businesses compare to broader trends","Dataset already listed","81","180"
"Wheelchair users","2013-12-12 11:45:43","2024-04-14 16:53:57","Statistics New Zealand","How many people in NZ are suffering from mobility impairments?

How many people in NZ rely upon powered wheelchairs to get on with their activities of daily Living?

How many people are not prescribed powered wheelchairs at all, either because they are physically unable to control the chair using a conventional interface, or because they are deemed incapable of driving safely?
","","The University of Waikato is considering to develop a prototype of mind controlled wheelchair and we would like to know the actual demand for this type of rehabilitative device.","Agency responded","81","181"
"Motorcycle registrations","2013-11-19 09:19:18","2018-05-16 10:28:54","New Zealand Transport Agency","I would like to know the top 10 motorcycle models and brands imported new and used into NZ","allow us to provide the best solutions to the industry.","To better serve the new and used motor cycle parts supply .","Agency notified","80","177"
"Waikato Liquefaction Shapefile","2013-12-02 10:02:01","2015-10-16 13:17:37","Waikato Regional Council","Is it possible to send me a shapefile showing the areas of liquefaction risk in the Waikato please?  We need this are part of our readiness preparation to help us assess the risks to WEL's electrical distribution network throughout the Waikato Region.

Kind regards
Roger Oed
Asset Information Manager
WEL Networks Ltd","","Assess risk to the electrical network","Agency responded","77","179"
"Cell tower sites","2011-09-16 09:27:44","2024-05-02 12:51:24","Ministry of Business innovation and Employment","GPS coordinates of all cell tower sites in NZ.","Plotting cell towers visually for punters with mobile devices","Using geolocation on AGPS and GPS/APGS devices.  Mapping data on HTML5 geolocation web pages/sites.

Geolocation is an area of increasing interest - cell towers are an important part of this.","Agency responded","76","53"
"Historical weather observations","2013-07-22 11:36:38","2024-03-28 09:07:40","National Institute of Water and Atmospheric Research Limited","Would like to see the release of all previous year's weather observations (wind, temp, humidity, rain etc) for all weather stations owned by any government agency. To be available to download in an open file format. ","","understanding of the environment & to help businesses to make better decisions. ","Agency notified","76","158"
"RAPID number database","2011-05-13 10:50:49","2024-04-11 20:04:13","New Zealand Fire Service Commission","The RAPID number database contains the mapping of RAPID rural addressing numbers.","By releasing the RAPID addressing database (e.g. RAPID number + lat/long) this would enable the data to be included in GPS navigation map sets such as the free nzopengps.org","Navigating to rural proprerties via GPS can be a challenge.","Dataset already listed","75","21"
"Bulk sale price data for individual houses","2014-07-13 09:55:50","2023-12-16 04:25:50","Quotable Value Limited","Bulk sale price data for all house sales in New Zealand, along with any other supporting data e.g.: method sold (auction/etc), number bedrooms, bathrooms, size sqm, land size etc. This data should be available as a bulk feed/API, supporting historical queries and returning all available data.","giving access to house purchasers, through direct access or publication by any interested party.","Having access and being able to easily find house sale price data for a variety of analysis and visualisations. House purchasers have little access to compare the histories of house sales without paying significant amounts of money.

Other countries have much better access to this data than New Zealand (e.g.: Zillow in the US) for free. This data is part of the public record and allowing bulk access will bring NZ into line with other countries.","Agency responded","75","203"
"Average Annual Daily Traffic for all roads in New Zealand","2018-03-13 13:36:45","2024-04-12 12:56:49","NZ Transport Agency","Average Annual Daily Traffic count data for all of New Zealand
Ideally, the dataset would include all NZ roads (NZTA managed roads plus roads managed by local councils and alliances)

Each road controlling authority is required to manage and make available AADT statistics for planning purposes - it would be far better to have a single nationalised dataset.","Allowing roadworks planners the ability to look up the road level for any road in NZ and understand the impact their work may have as well as the level of traffic management required without conducting a site visit or making individual requests to the Road Controlling Authority. 

Allowing consenting and auditing software to show the required level of traffic management required to both applicants and consenting officers.  ","Knowing what level of traffic management is required for specific worksites.","Agency notified","72","337"
"New Zealand Geologic shapefile","2014-04-22 01:55:01","2023-07-05 22:10:38","Institute of Geological and Nuclear Sciences Limited","I am looking for a geologic shapefile of this country showing the basic geologic structure and units and the spatial coordinates.","","This is a home study project","Agency notified","72","190"
"Location of all places issued a sale of alcohol licence","2014-06-19 16:39:32","2022-10-08 20:29:53","Ministry of Justice","Information including the actual street address where all alcohol licences have been issued too. XLS format would be perfect. 

With this list it will be possible to map and therefore visually see the true impact of how many licences are issued around various parts of the country","Providing enough data to perform Geo mapping of the locations and therefore mashing the data with other things","Not being able to see where all licences have been issued","Agency responded","70","200"
"Public Holidays in CSV/XLXS format","2018-04-12 11:56:33","2024-04-12 12:56:11","Ministry of Business Innovation and Employment","Current there is a Public Holidays Dataset, but only available as PDF. Could this dataset also be made available as CSV or XLSX or potentially another format (REST API JSON) that could be digested by software. We synchronize our internal system with public holidays, and presently its a manual process. Would love to be able to write some software that makes a automated call (perhaps once a year) to update our data ","","as Above in description","Agency responded","69","342"
"2011 General Election results by age group","2014-03-20 09:28:25","2022-05-17 23:31:34","Electoral Commission","Results for each electorate from the 2011 General Election, broken down by age groups (~5years).","","Allow people to analyse how different age groups are voting in different areas. ","Agency responded","69","184"
"New Zealand Fire Service Localities GIS Data","2015-01-13 09:06:24","2020-08-07 02:56:26","New Zealand Fire Service Commission","Dear New Zealand Fire Service Commission,

I am requesting the Localities GIS data from your agency.  I would like this data in gis format (shapefile or esri filegeodatabase).  The dataset is mentioned on these official New Zealand Government websites if you need clarification as to what data I am requesting:
https://data.govt.nz/datasetrequest/show/4
 <ul>
<li>http://www.waikatoregion.govt.nz/Environment/Environmental-information/REDI/1175142/</li>
 <li>http://www.ombudsman.parliament.nz/system/paperclip/document_files/document_files/885/original/179451_-_request_for_nz_localities_dataset.pdf?1413915614</li>
 </ul>
I look forward to your response.

Yours faithfully,

Justin","having a good baseline dataset that has current up to date information","a up to date gis dataset for all localities (LINZ and koordinates have either outdated data or data at a level below or above this level of detail)","Agency responded","68","226"
"Parliament Membership History","2023-06-09 11:51:33","2024-04-12 12:30:26","Parliamentary Service","Currently names of the Members of Parliament before 1996 are not in an accessible database.","Giving the public the names of MPs before 1996 easily.","Making this data accessible to the public will solve the issue of finding MPs from before 1996.","Agency notified","66","918"
"Outstanding Infringement/Fines ","2014-05-20 13:52:48","2021-04-06 20:35:55","New Zealand Police","I am working current on a mobile app that allows you to see your outstanding infringement notices/fines searchable by registration or licence number. The app also allows the using to chech their demerit points. So the dataset I am looking for should include fine information and demerit points. The data format required is csv. ","reduce the overall adminstration and  advertising cost.  ","decreasing the current amount of outstatnding fines owed to government.","Agency responded","66","196"
"High Risk Intersections","2014-03-26 21:21:42","2024-04-12 13:03:33","New Zealand Transport Agency","Please provide this as a CSV.

http://www.nzta.govt.nz/resources/high-risk-intersections-guide/docs/high-risk-intersections.pdf

It would be useful if an additional field of GPS co-ordinates was added.","Data can be extracted into maps, for display on websites, for inclusion in navigation products (e.g. get a warning on your GPS navigator that a dangerous intersection is coming up). It would increase the visibility of this data","Current format is PDF, text heavy, table, not easily readable, or useful to regular people.","Dataset already listed","64","185"
"Property sale transaction data.","2016-02-29 12:32:11","2024-04-29 15:24:38","Quotable Value Limited","Property sale transaction data. This would include the type of property, the sale price, sale date, size of dwelling and section, number of bedrooms, bathrooms. Ideally this would be made available as an API, however it could simply be released in a csv format.


 

","This would improve transparency in the property market. It would enable buyers and sellers to make more informed decisions about the value of a property before making or accepting an offer.

Opening up this information would also allow analysis by journalists and individuals parties. Currently much of the information about the property market comes from real estate agents who have a vested interest to talk the market up.","Lack of transparency in the market.

Balance information in the marketplace that is currently dominated by those with a vested interest, for example real estate agents and banks.","Agency notified","63","271"
"FarmsOnLine - GIS Layer(s) for Landuse","2011-05-17 15:17:12","2022-11-21 11:56:05","Ministry for Primary Industries","GIS files containing land use as collected and held by the FarmsOnLine web map portal

https://farmsonline.maf.govt.nz/

This is information sourced from the public domain (physical location, land use and LINZ title information).","Releasing this data would allow us to improve on it at a local level. 

Releasing the data would also allow innovative re-use to encourage economic growth.","Currently we hold no information on horticultural land use in our region.  We would like to plan for growth in this area.","Agency responded","63","22"
"Duration of Primary Teaching Careers in New Zealand","2014-02-17 12:38:09","2015-10-19 10:55:45","Ministry of Education","For example, total numbers of teachers  (primary or secondary) registered each year, duration of employment as a teacher/principal teacher, how many are actively employed currently within each NZ region, how many teachers have allowed their  Certificate of Registration to lapse. If also possible/recorded, how many have emigrated, have retired, or have resigned or resigned under a constructed dismissal.  Comma separated List format. ","Allowing researchers to access relevant data. ","The mystery regarding our nation's supposed teacher shortage.
The planning (ie. effective planning) for teaching student intakes each year.
The placement of qualified teachers in areas in which teachers seem to avoid.","Dataset already listed","63","183"
"demand of electricity ","2014-04-24 08:58:26","2016-04-26 08:32:27","Electricity Authority","monthly in different cities in NZ","","compare it with electricity supply and try to make cleaner electricity ","Agency responded","63","191"
