"Title","Created","LastEdited","Agency","Description","ProblemBy","ProblemOf","Status","Votes","ID"
"Government financials","2011-04-01 16:23:27","2015-10-16 11:11:35","The Treasury","Lack of detailed tax/revenue/economic data and models hinders NZ economy. ","","Build business intelligence tools to help the private sector, and the public analyse proposed policies.","Agency responded","8","2"
"Foxton - DEM - Urban - 2013 LiDAR","2020-08-24 15:39:10","2024-04-29 15:45:21","Horowhenua District Council","Urban DEM data for the Foxton region, taken in 2013 via satellite LiDAR.","Allowing us to import the file into GIS programs, which can then extract 1m contour data.","Needing topography for more accurate liquefaction assessment results and other geotechnical engineering concerns.
The data can be viewed on the Horowhenua District Council GIS portal, but cannot be downloaded.","Agency notified","8","516"
"Chemical Toilet Locations CHCH","2011-07-15 18:04:34","2015-10-16 11:31:21","Christchurch City Council","It would be great to get GPS co-ordinates of chemical toilet locations, or even just approximate addresses.","A service could be made public whereby someone could search for toilets in an X km radius from their home.","Allow people to find alternatives chemical toilets if there are problems with the ones in their area.","Agency responded","8","36"
"International Visitor Survey - Raw Data","2011-08-25 16:57:23","2015-10-19 13:37:40","Ministry of Economic Development","We would like access to the Raw data for the International Visitor Survey, and ideally the Visitor Arrival Data ","We would be able to perform the analysis","We want to do an analysis of people touring New Zealand - seperate from those going to single destinations.","Agency notified","8","49"
"National School Location dataset","2017-06-12 11:20:35","2020-03-17 13:19:09","Ministry of Education","Preferably as a service, locations of all schools nationwide.","providing accurate and up to date easily consumable datasets.","Keeping copies locally of school locations, inaccuracies due to school closures.","Agency notified","8","309"
"Adolescent birth rate (aged 10-14 years; aged 15-19 years) ","2017-07-30 13:57:37","2022-08-08 07:02:44","Ministry of Health","Adolescent birth rate (aged 10-14 years; aged 15-19 years) ","It would make this dataset available. This means researchers will be able to easily locate the adolescent birth rate. This data set also serves as an indicator for the UN's Sustainable Development Goal 3 - Ensure healthy lives and promote well-being for all at all ages . Opening up this dataset would help us track our nation. ","Not having the Adolescent birth rate (aged 10-14 years; aged 15-19 years) available on your website","Agency responded","8","320"
"All postcodes and their rolling up to suburb, town/city, region and NZ","2023-01-18 16:15:56","2024-02-09 11:14:16","New Zealand Post Limited","Please can we have a CSV with all postcodes and their rolling up to suburb, town/city, region and NZ"," We will be able to better engage with these customers/partners","We often require customers/partners to enter address information into fields.  While they'll enter postcode ok, often the other fields e.g. address 1, address 2 - are entered inconsistently

In order for us to correctly identify the suburb, town/city, region we will be able to better engage with these customers/partners","Agency notified","8","854"
"Liquor Licence Locations","2012-07-15 14:07:11","2017-08-02 10:44:56","Dunedin City Council","The location data of On, Off and Club Licences (i.e. not special licences). At a minimum the addresses of these locations would be useful (it is likely someone would convert these to coordinates upon the release of the data) however any additional information, such as expiry date, would be useful.

The data would be most useful in CSV or Excel format","Mapping this data publicly","Education about the density of alcohol outlets","Agency notified","8","99"
"Dog control","2012-08-13 14:30:16","2015-10-16 13:09:16","Department of Internal Affairs","How many dog attacks are by unregistered and/or un-neutered dogs?","","Understanding the topic of castration as a solution to dog control ","Agency notified","8","101"
"Public BBQ locations and coordinates in NZ","2019-01-11 19:11:19","2022-10-29 19:15:01","Bay of Plenty Regional Council","I am interested in creating a free web application which will show the geographic locations of public BBQs around New Zealand, being able to show you the closest public BBQ near you. I aim to encourage a higher usage of these great public facilities.

I am interested in finding out whether the council has the coordinates of the public BBQs in the Bay of Plenty region, and if not, could you lead me in the right direction?","","I am interested in creating a free web application which will show the geographic locations of public BBQs around New Zealand, being able to show you the closest public BBQ near you. I aim to encourage a higher usage of these great public facilities.

I am interested in finding out whether the council has the coordinates of the public BBQs in the Bay of Plenty region, and if not, could you lead me in the right direction?","Agency responded","8","371"
"Karori Cemetery plot data","2019-02-18 22:41:26","2023-08-19 17:12:27","Wellington City Council","The site https://wellington.govt.nz/services/community-and-culture/cemeteries/cemeteries-search provides a portal for searching by people's names and where they are buried. I would like access to this database.","","It should allow mapping of the cemetery, as well as providing insights into patterns of how and when people die, and what types of names were used over different periods of time.","Agency notified","8","377"
"New Zealand towns postcodes","2019-02-25 15:24:15","2022-11-25 05:11:38","New Zealand Post Limited","For work purposes, we need a list of New Zealand towns postcodes in excel format","load those data to our new system","Purchasing software/service to get the data in required format","Agency notified","8","379"
"Administrative data on income assistance","2012-11-25 11:14:46","2019-11-25 13:00:06","Ministry of Social Development","Linked administrative data on  characteristics of those applying for and receiving benefits from WINZ as well as payments from the IRD such as paid parental leave and Working for Families.  Obviously such data would need to be de-identified, but would ideally include information on demographics and employment history.

Given the large number of observations, the data would perhaps be best broken into a dataset for each year going back as far as is possible but at least 10-15 years.  Observations would be individuals, and variables would include the length of time the individual had received the relevant form(s) of income assistance that year.

Individuals would be assigned a unique identifier that is consistent between years so as to allow longitudinal analysis.","Allowing social scientists access to this data will lead to insights that could be used to increase the effectiveness of policy.","New Zealand welfare policy is topical and controversial.  Researchers whose interests lie in this area are currently limited to small samples from various surveys performed by Statistics New Zealand.  The evidence that informs policy is therefore limited as many experts are unable to contribute.","Agency notified","8","125"
"Request Accredited Employer list","2023-04-19 19:56:33","2024-03-20 08:36:57","Invercargill City Council","Hi team, may i have the list of Accredited employer at NZ? Thank you.","","I am looking for a job to stay at NZ. I am currently ESWV holder. Tq.","Agency responded","8","894"
"list of nz postcodes and regions","2023-05-19 09:29:59","2024-02-19 15:21:08","New Zealand Post Limited","pls provide me with a list of nz postcodes and regions in csv file.","i would be able to email our clients in a region when there is a natural disaster using the post code from their address","i would be able to email our clients in a region when there is a natural disaster using the post code from their address","Agency notified","8","904"
"New Zealand Export Log Volume ","2013-04-04 13:20:50","2023-07-12 09:49:10","Ministry of Agriculture and Forestry","New Zealand Export Log Volume by Port of Loading.  Volume in JAS m3 by Grade/Product (if possible), also Sales $NZ FOB.  Period Jan/2000 to Dec 2012, information by month (if possible).
   ","Providing quantitative evidence of potential volume available for processing in NZ","Understanding regional export log sales and opportunity for additional processing within NZ","Agency notified","8","143"
"Historical public holiday dates","2023-06-29 14:13:59","2024-05-20 12:49:23","Statistics New Zealand","I would like an excel sheet with all public holiday dates from 1986 to 2030. I would like the provincial anniversary dates to be in a seperate coloum or have a specific naming convention so I can filter these. ","Decreasing total hours spent on manual calculations and increasing productivity and accuracy by being able to use a calculator for working days. ","I am currently automating some of our work in the Tenancy compliance and investigations team at MBIE and would like to use this data to enable our working day calculator. The benifit of this will be less reliance on manual work for our national team and hence more productivity. This will also directly translate to more value for all stakeholders. ","Agency notified","8","929"
"Councillors' expenses during Covid-19 restrictions","2023-09-02 12:52:01","2023-10-18 00:04:43","Far North District Council","As a ratepayer of the FNDC, I'm curious as to how much money each individual elected Councillor claimed in expenses during the Covid-19 lockdown periods of 2020 and 2021.","Improve transparency of public expenditure.","Lack of transparency of FNDC expenditure. This information is not found on the FNDC website or the annual reports.","Agency notified","8","952"
"csv DOWNLOAD OF POSTCODES","2021-12-08 10:46:47","2024-04-18 16:47:14","New Zealand Post Limited","csv File of all NZ postcode please and their corresponding city/region e.g Orewa 0931","Helps business keep up to date with relevant post codes and helps to streamline processes.","Updating our ERP systems to ensure all freight has the correct Postcodes for couriers and customer billing.","Agency responded","8","700"
"postcode lists","2021-12-29 13:35:26","2023-06-08 10:01:27","New Zealand Post Limited","Request a list of all NZ postcodes please and the corresponding areas they represent","We would print the lists off to use as a resource for everyone at our postcode making the correct postcode available to us quickly onsite.","we are RD posties and we would be able to identify wrongly addressed mail easily and find the relevant correct postcode quickly at work (where we do not have access to a computer). It would solve the problem of letters and parcels returning wrongfully to us again and again and again.","Agency notified","8","710"
"Comprehensive Traffic, Weather, and Air Quality Data for Auckland","2023-11-28 15:54:17","2023-12-04 15:14:08","Statistics New Zealand","We are requesting non-personal, non-secure datasets related to traffic flow, weather conditions, and air quality measurements in Auckland. Specifically, we are interested in:

Detailed traffic data, including vehicle counts and congestion levels, preferably segmented by time of day and location.
Historical weather data encompassing temperature, humidity, wind speed, and precipitation.
Air quality data, including measurements of pollutants such as PM2.5, PM10, NOx, and CO2 levels.
We are seeking data for the period from 2015 to the present to observe long-term trends. The preferred formats for this data are CSV, Excel, or any other machine-readable format that allows for detailed analysis.

Opening this data would solve the problem of ...
Inadequate understanding of the factors affecting air quality in Auckland and the inability to predict changes effectively. This data is crucial for academic research aimed at developing predictive models to forecast air quality variations, contributing to public health and urban planning initiatives.","Allowing us to analyze the correlations between traffic patterns, weather conditions, and air quality. This analysis will enable the development of a predictive model to forecast air quality, helping policymakers and the public make informed decisions. Opening this data also supports academic research and contributes to the global understanding of urban environmental challenges.

","Inadequate understanding of the factors affecting air quality in Auckland and the inability to predict changes effectively. This data is crucial for academic research aimed at developing predictive models to forecast air quality variations, contributing to public health and urban planning initiatives.","Agency notified","8","988"
"Comprehensive Traffic, Weather, and Air Quality Data for Auckland","2023-11-28 16:00:34","2023-12-04 15:14:01","Meteorological Service of New Zealand Limited","We are requesting non-personal, non-secure datasets related to traffic flow, weather conditions, and air quality measurements in Auckland. Specifically, we are interested in:

Detailed traffic data, including vehicle counts and congestion levels, preferably segmented by time of day and location.
Historical weather data encompassing temperature, humidity, wind speed, and precipitation.
Air quality data, including measurements of pollutants such as PM2.5, PM10, NOx, and CO2 levels.
We are seeking data for the period from 2015 to the present to observe long-term trends. The preferred formats for this data are CSV, Excel, or any other machine-readable format that allows for detailed analysis.

Opening this data would solve the problem of ...
Inadequate understanding of the factors affecting air quality in Auckland and the inability to predict changes effectively. This data is crucial for academic research aimed at developing predictive models to forecast air quality variations, contributing to public health and urban planning initiatives.","Allowing us to analyze the correlations between traffic patterns, weather conditions, and air quality. This analysis will enable the development of a predictive model to forecast air quality, helping policymakers and the public make informed decisions. Opening this data also supports academic research and contributes to the global understanding of urban environmental challenges.

","Inadequate understanding of the factors affecting air quality in Auckland and the inability to predict changes effectively. This data is crucial for academic research aimed at developing predictive models to forecast air quality variations, contributing to public health and urban planning initiatives.","Agency notified","8","990"
"Current list of licensed pharmacies and hospital pharmacies","2022-03-26 21:14:39","2024-02-09 16:38:04","Ministry of Health","List of licensed pharmacies and licensed hospital pharmacies which is updated on a regular basis. The data should contain Legal Entity Name, Premises Name, DHB, Street Address, Town/City, Postal Code, and License Expiry Date and Type of Pharmacy.","There is an obligation on organizations in the pharma industry to verify the authenticity of their customers and suppliers - first before trading with them, and the re-verify the status periodically - minimum annually. Providing such a register would help organizations in the pharma industry to easier ensure they procure and sell medicinal products only to entities authorized to do so.","...not having an aggregated list of all pharmacies and hospital pharmacies. Obtaining current data on approved (licensed) pharmacies It is critical to know if a pharmacy's license is up-to-date when distributing medicines to them. ","Agency responded","8","736"
"New Zealand Fire Service Localities GIS Data (Polygon)","2015-03-24 13:15:28","2021-04-07 16:41:16","New Zealand Fire Service Commission","Hello I saw that this person request this data and was successful. 
https://data.govt.nz/datasetrequest/show/226


I would also like to request this data for the New Plymouth District Council.  I'm the GIS Developer at the council and am needing this information for some asset management work.  Look forward to your response.  Thanks for your time.

Shapefile format would be great.","having a good baseline dataset that has current up to date information","a up to date gis dataset for all localities (LINZ and koordinates have either outdated data or data at a level below or above this level of detail)","Agency notified","8","240"
"Farms Online Geospatial Data","2015-04-21 12:39:57","2023-08-24 09:55:03","Ministry for Primary Industries","The Ministry of Primary Industry's 'Farms Online' Database is presently displayed in the public domain on a site by site locational basis.  See here for an example of the publicly available:  https://farmsonline.mpi.govt.nz/Search/Farm?farmId=146735# 
It would be helpful if this information could be made available in geospatial shapefile format.","Some industry groups (such as the Poultry Industry Association of NZ) have been actively encouraging their members to register on this site because it will help protect their interests.  See http://pianz.org.nz/industry-issues/exotic-diseases/farmsonline-essential-biosecurity-protection-for-the-rural-sector

By enabling the re-use of this data for the purposes of comparing the spatial relationships of these properties with other public datasets that would enable data driven decision making to occur.  The alternative presently being experienced is a large amount of regulatory intervention (and increased compliance costs) due to speculation as to the degree of severity of potential land use conflicts.","At this very moment I am participating in a regulatory planning process about the management of activities and growth in the rural parts of Auckland.  There is debate presently taking place about the degree of land use conflicts that presently exist around intensive farming activities, including horticulture, factory farming, intensive farming, and rural activities such as poultry production and processing.","Agency responded","8","241"
"Public Health data - Influenza, Viruses etc","2015-07-31 15:10:27","2018-01-30 20:10:21","Ministry of Health","Data on the Public Health Surveillance website (https://surv.esr.cri.nz/index.php) is currently distributed in PDF format.  This makes the data almost unusable for other interested parties (eg. computer modellers, public health researchers etc).

It would be helpful if the data on this website could be made available - perhaps via APIs.","","Modelling the behaviour of health and ill-health can assist with data visualisation to give researchers and the public a sense of how disease can spread.  It could also be used to model future epidemics.","Agency responded","8","251"
"Median rental prices by TA & by suburb","2016-02-08 15:21:01","2024-04-12 13:00:14","Ministry of Business Innovation and Employment","The median rental price of properties in each territorial authority & the median rental price of properties in each suburb of NZ

CSV format, 1993 onward (same as mean rents by TA dataset currently available) ","","Mean data by TA (currently available) does not provide for analysis of trends at the suburb level. There is a lot of variation in rental prices at the suburb level within TA's. Having suburb data will allow specific suburb trend analysis to be conducted. 

Median rental price data is useful, yet only means are currently available","Agency notified","7","268"
"Public Access Easements - Crown Forest Licences over Crown lands","2016-06-15 13:56:10","2023-10-09 21:42:07","Land Information New Zealand","There are many Public Access Easements across Crown Forest Licences over Crown lands managed by LINZ. These provide walking and vehicle access to Forest Parks, Conservation Parks, Public Conservation Land and public water bodies, and mountainbiking opportunities, and driving access within the Crown Forest Licences to walk everywhere.","Giving everyone the ability to map all public access over these Crown lands.","The public and DOC managers do not know where these easements are to plan walking, tramping, mountainbiking, hunting and fishing access. The data needs to be incorporated into DOC recreation mapping and Walking Access Commission mapping and systems so that the public have complete information of where they have driving rights of access. The public would also know where they can drive withing Crown Forest Licences, such that they can better go for a walk within the Crown Forest Licences which they are legally entitled to do, subject to forestry operations restrictions.","Agency notified","7","283"
"All cause mortality NZ","2022-10-04 16:25:27","2023-01-19 12:45:36","Statistics New Zealand","I would like the figures for the last 30 years please","In time it would potentially help solve the problems by understanding the causes","Understanding the rates of suicide and other trends","Agency responded","7","799"
"Gestational diabetes by DHB's","2016-10-28 15:17:54","2021-03-30 22:24:23","Ministry of Health","Thank you for your support. We are doing research in the area of gestational diabetes and would like to work out by DHB's how many women during pregnancy have been diagnosed with gestational diabetes compared to the birth rate for each DHB and the birth outcomes. The most recent statistics would be very helpful, e.g. 2014 but could also be earlier if that is only available.","the data would give us an understanding of how many women are being diagnosed with gestational diabetes (GDM) and provide further clarification if the trend is going up, as this appears to be currently the perception. The comparison to birth occuring in the DHB without GDM diagnosis will enable us to work out the percentage of GDM for each DHB and compare the birth outcomes. Thank you.","the data would give us an understanding of how many women are being diagnosed with gestational diabetes (GDM) and provide further clarification if the trend is going up, as this appears to be currently the perception. The comparison to birth occuring in the DHB without GDM diagnosis will enable us to work out the percentage of GDM for each DHB and compare the birth outcomes. Thank you.","Agency notified","7","294"
"Directory of Iwi and Maori organisations Te Kahui Mangai","2011-08-01 16:51:30","2015-10-16 11:33:24","Te Puni Kōkiri (Ministry of Māori Development)","Can we please obtain a copy of the ""Directory of Iwi and Maori organisations Te Kahui Mangai"" dataset as KML or SHP?","","not having public access to accurate GIS data for all the iwi and hapu.","Agency responded","7","40"
"New Zealand Gun crime numbers by electorate from 2009 - 2020","2021-01-04 07:20:18","2022-06-03 11:15:58","New Zealand Police","A CSV dataset showing the number of gun crimes (including incidents where guns were brandished to threaten, but not used to cause harm , to Police personnel and the public) by region , from 2009 - 2020.
This would be most useful as a CSV file that can be visualised using Python Pandas or Microsoft Power BI.
Year
Month
Day
Electorate 
Number of victims
Number of perpetrators
Physical Harm to victim(s) by gun (Y/N)
Death by gun (Y/N)
Perpetrator Licensed to own a gun (Y/N)
","Giving numbers and trends that would, hopefully, drive a logical conversation around the issue of gun control and changes to klaws that would actually protect our front line Police personnel and innocent shop keepers.","Visualizing this data for the public, to see if the gun law amendments made since 2009 have had any effect on the incidence of gun crime in New Zealand, and create a framework based on reality, for future gun control laws.","Agency responded","7","554"
"Otago geographic data","2011-08-30 09:11:44","2015-10-29 16:34:22","Otago Regional Council","Data of Otago rivers, lakes, streams, locations of flood warning systems, air quality/control, bus routes, walking/activity tracks/parks in and around Dunedin and Otago - ie. non-DOC administered tracks.","Allowing others to create sites and 'mash-ups' for the promotion of Otago and suitable use initiatives.","Finding data specific to Otago.  At the moment there isn't a lot of direct data.","Agency notified","7","51"
"NZ Post Codes","2021-02-24 08:43:00","2022-11-25 05:11:56","New Zealand Post Limited","I would like a CSV list of all NZ Post codes with city and suburb included","","Ensuring accuracy addresses for NZ Post","Agency notified","7","568"
"Meshblock Centres","2012-02-09 11:36:47","2016-02-05 22:29:45","Statistics New Zealand","Having to deal with SHP files other GIS files is terrible. Some extra flat text files (XML/CSV/KML) containing a mapping from Meshblock names to their centre would be nice, and allow actual usage of the 2006 census data.","","Actually using 2006 census data without pissing about.","Agency responded","7","77"
